{
  "schemaVersion": 2,
  "id": "plugin.d4454a31d9a73dcb8ab2473afd9670713e23317a4c819354d54d4b5695c2ada6",
  "name": "AiLi1337/dsh-context-length",
  "displayName": "AiLi1337/dsh-context-length",
  "version": "unversioned",
  "versionScheme": "unknown",
  "type": "plugin",
  "description": "DSH (DeepSeek Harness) 插件：在「设置 - 模型」下方新增「上下文长度」页面，为指定渠道（提供方）的指定模型自定义上下文窗口长度，点击保存后才写入生效。",
  "license": "unknown",
  "targets": [
    {
      "agentId": "dsh",
      "agentVersionRange": null,
      "versionScheme": "unknown",
      "compatibilityStatus": "unknown",
      "compatibilityNote": "Discovery association only; no parseable upstream Agent compatibility range was supplied."
    }
  ],
  "createdAt": "2026-10-02T05:18:39Z",
  "updatedAt": "2026-10-02T05:18:39Z",
  "pluginDetails": {
    "manifestPath": "package.json",
    "sourceType": "git"
  },
  "links": {
    "repository": "https://github.com/AiLi1337/dsh-context-length",
    "readme": "https://github.com/AiLi1337/dsh-context-length#readme"
  },
  "distributions": [
    {
      "id": "upstream-git",
      "type": "git",
      "url": "https://github.com/AiLi1337/dsh-context-length"
    },
    {
      "id": "npm-3015c5944379",
      "type": "registry",
      "url": "https://www.npmjs.com/package/dsh-context-length",
      "registry": "npm"
    }
  ],
  "keywords": [
    "memory",
    "models"
  ],
  "_meta": {
    "org.agentforge/collection": {
      "sources": [
        {
          "repository": "dshworks/awesome-dsh-plugins",
          "revision": "6c211eaaab7e74e7cb3e5c04110ec1db88510074",
          "path": "data/plugins.json",
          "entry": "2606"
        },
        {
          "repository": "white0dew/awesome-dsh-plugins",
          "revision": "55ece09ae6278782389c3cc64691ec8797b26623",
          "path": "data/sources/github-plugin-catalog.json",
          "entry": "5380"
        },
        {
          "repository": "white0dew/awesome-dsh-plugins",
          "revision": "55ece09ae6278782389c3cc64691ec8797b26623",
          "path": "data/sources/github-topic-dsh-plugin.json",
          "entry": "7810"
        },
        {
          "repository": "bruc3van/awesome-dsh-plugin",
          "revision": "d562ead4b6b62cc8ebaf77f469335dfd6b659897",
          "path": "data/repositories.json",
          "entry": "9976"
        }
      ],
      "classification": "upstream-metadata",
      "observedAt": "2026-10-02T05:18:39Z"
    }
  }
}
