{
  "schemaVersion": 2,
  "id": "mcp.io.github.TonyWang-hub/mcp-cn-commerce",
  "name": "io.github.TonyWang-hub/mcp-cn-commerce",
  "version": "0.1.5",
  "versionScheme": "semver",
  "description": "Read-only merchant data from 8 Chinese e-commerce platforms: orders, products, after-sales, ads",
  "license": "MIT",
  "links": {
    "repository": "https://github.com/TonyWang-hub/mcp-cn-commerce",
    "readme": "https://github.com/TonyWang-hub/mcp-cn-commerce#readme"
  },
  "keywords": [],
  "type": "mcp",
  "mcpDetails": {
    "registryType": "pypi",
    "identifier": "mcp-cn-commerce",
    "registryBaseUrl": "https://pypi.org/",
    "transport": "stdio"
  },
  "targets": [
    {
      "agentId": "dsh",
      "agentVersionRange": null,
      "versionScheme": "unknown",
      "compatibilityStatus": "unknown",
      "compatibilityNote": "The archived source did not provide a parseable Agent version range; this record is metadata-only and unverified.",
      "status": "active"
    }
  ],
  "distributions": [
    {
      "id": "upstream",
      "type": "registry",
      "url": "https://pypi.org/project/mcp-cn-commerce/",
      "priority": 10,
      "registry": "pypi"
    }
  ],
  "lifecycle": {
    "status": "active"
  },
  "createdAt": "2026-09-22T09:00:00Z",
  "updatedAt": "2026-09-22T09:00:00Z",
  "publishedAt": "2026-09-22T09:00:00Z",
  "_meta": {
    "io.github.metaone01/registry": {
      "source": "registry.modelcontextprotocol.io",
      "serverName": "io.github.TonyWang-hub/mcp-cn-commerce",
      "publishedAt": "2026-07-12T19:08:44.181609Z",
      "updatedAt": "2026-07-12T19:08:44.181609Z",
      "identityEvidence": "pypi-json"
    },
    "org.agentforge/migration": {
      "sourceSchemaVersion": 1,
      "collectedAt": "2026-09-22T09:00:00Z",
      "legacyPath": "sources\\mcp\\packages\\io.github.tonywang-hub__mcp-cn-commerce.json"
    }
  }
}
