{
  "schemaVersion": 2,
  "id": "mcp.io.github.asklokesh/xero-mcp-server",
  "name": "io.github.asklokesh/xero-mcp-server",
  "version": "0.1.0",
  "versionScheme": "semver",
  "description": "MCP server for Xero API integration",
  "license": "unknown",
  "links": {
    "repository": "https://github.com/asklokesh/xero-mcp-server",
    "readme": "https://github.com/asklokesh/xero-mcp-server#readme"
  },
  "keywords": [
    "Xero"
  ],
  "type": "mcp",
  "mcpDetails": {
    "registryType": "pypi",
    "identifier": "xero-mcp-server",
    "registryBaseUrl": "https://pypi.org/",
    "transport": "stdio"
  },
  "targets": [
    {
      "agentId": "dsh",
      "agentVersionRange": null,
      "versionScheme": "unknown",
      "compatibilityStatus": "unknown",
      "compatibilityNote": "The archived source did not provide a parseable Agent version range; this record is metadata-only and unverified.",
      "status": "active"
    }
  ],
  "distributions": [
    {
      "id": "upstream",
      "type": "registry",
      "url": "https://pypi.org/project/xero-mcp-server/",
      "priority": 10,
      "registry": "pypi"
    }
  ],
  "lifecycle": {
    "status": "active"
  },
  "createdAt": "2026-09-22T09:00:00Z",
  "updatedAt": "2026-09-22T09:00:00Z",
  "publishedAt": "2026-09-22T09:00:00Z",
  "_meta": {
    "io.github.metaone01/registry": {
      "source": "registry.modelcontextprotocol.io",
      "serverName": "io.github.asklokesh/xero-mcp-server",
      "publishedAt": "2025-12-31T01:21:45.705665Z",
      "updatedAt": "2025-12-31T01:21:45.705665Z",
      "identityEvidence": "pypi-json"
    },
    "org.agentforge/migration": {
      "sourceSchemaVersion": 1,
      "collectedAt": "2026-09-22T09:00:00Z",
      "legacyPath": "sources\\mcp\\packages\\io.github.asklokesh__xero-mcp-server.json"
    }
  }
}
