{
  "schemaVersion": 2,
  "id": "mcp.io.github.Redseb/rpgmaker-mz-mcp",
  "name": "io.github.Redseb/rpgmaker-mz-mcp",
  "version": "1.2.0",
  "versionScheme": "semver",
  "description": "MCP server for RPG Maker MZ: maps, tile painting, events, database editing, and validation.",
  "license": "MIT",
  "links": {
    "repository": "https://github.com/Redseb/rpgmaker-mz-mcp",
    "readme": "https://github.com/Redseb/rpgmaker-mz-mcp#readme"
  },
  "keywords": [],
  "type": "mcp",
  "mcpDetails": {
    "registryType": "npm",
    "identifier": "rpgmaker-mz-mcp",
    "registryBaseUrl": "https://registry.npmjs.org/",
    "transport": "stdio"
  },
  "targets": [
    {
      "agentId": "dsh",
      "agentVersionRange": null,
      "versionScheme": "unknown",
      "compatibilityStatus": "unknown",
      "compatibilityNote": "The archived source did not provide a parseable Agent version range; this record is metadata-only and unverified.",
      "status": "active"
    }
  ],
  "distributions": [
    {
      "id": "upstream",
      "type": "registry",
      "url": "https://www.npmjs.com/package/rpgmaker-mz-mcp",
      "priority": 10,
      "registry": "npm"
    }
  ],
  "lifecycle": {
    "status": "active"
  },
  "createdAt": "2026-09-22T09:00:00Z",
  "updatedAt": "2026-09-22T09:00:00Z",
  "publishedAt": "2026-09-22T09:00:00Z",
  "_meta": {
    "io.github.metaone01/registry": {
      "source": "registry.modelcontextprotocol.io",
      "serverName": "io.github.Redseb/rpgmaker-mz-mcp",
      "publishedAt": "2026-07-29T11:53:41.993875Z",
      "updatedAt": "2026-07-29T11:53:41.993875Z",
      "identityEvidence": "npm-packument"
    },
    "org.agentforge/migration": {
      "sourceSchemaVersion": 1,
      "collectedAt": "2026-09-22T09:00:00Z",
      "legacyPath": "sources\\mcp\\packages\\io.github.redseb__rpgmaker-mz-mcp.json"
    }
  }
}
