{
  "schemaVersion": 2,
  "id": "mcp.io.github.shubhtoy/github-project-info",
  "name": "io.github.shubhtoy/github-project-info",
  "displayName": "io.github.shubhtoy/github-project-info",
  "version": "0.1.3",
  "versionScheme": "unknown",
  "type": "mcp",
  "description": "Read public GitHub Projects v2 boards without auth — items, fields, story points, priority.",
  "license": "unknown",
  "targets": [
    {
      "agentId": "dsh",
      "agentVersionRange": null,
      "versionScheme": "unknown",
      "compatibilityStatus": "unknown",
      "compatibilityNote": "Discovery association only; no parseable upstream Agent compatibility range was supplied."
    }
  ],
  "createdAt": "2026-09-22T09:00:00Z",
  "updatedAt": "2026-10-02T05:18:39Z",
  "mcpDetails": {
    "registryType": "npm",
    "identifier": "github-project-info-mcp",
    "transport": "stdio"
  },
  "distributions": [
    {
      "id": "upstream-83562a8f2b9382cc",
      "type": "registry",
      "url": "https://www.npmjs.com/package/github-project-info-mcp",
      "registry": "npm",
      "version": "0.1.3"
    }
  ],
  "links": {
    "repository": "https://github.com/shubhtoy/github-project-info-mcp"
  },
  "lifecycle": {
    "status": "active"
  },
  "_meta": {
    "io.github.metaone01/registry": {
      "source": "registry.modelcontextprotocol.io",
      "serverName": "io.github.shubhtoy/github-project-info",
      "publishedAt": "2026-07-06T07:40:41.042046Z",
      "updatedAt": "2026-07-06T07:40:41.042046Z",
      "identityEvidence": "npm-packument"
    },
    "org.agentforge/migration": {
      "sourceSchemaVersion": 1,
      "collectedAt": "2026-09-22T09:00:00Z",
      "legacyPath": "sources\\mcp\\packages\\io.github.shubhtoy__github-project-info.json"
    },
    "org.agentforge/collection": {
      "sources": [
        {
          "repository": "mcp-registry",
          "path": "v0.1/servers?page=329",
          "revision": "2026-10-02T05:18:39Z",
          "entry": "io.github.shubhtoy/github-project-info"
        }
      ],
      "classification": "upstream-metadata",
      "observedAt": "2026-10-02T05:18:39Z"
    }
  }
}
