{
  "schemaVersion": 2,
  "id": "mcp.io.github.hadriangateway/platter",
  "name": "io.github.hadriangateway/platter",
  "version": "2.0.3",
  "versionScheme": "semver",
  "description": "MCP server exposing Read, Write, Edit, Bash, Glob, Grep, and JS tools over stdio.",
  "license": "unknown",
  "links": {
    "repository": "https://github.com/hadriangateway/platter",
    "readme": "https://github.com/hadriangateway/platter#readme"
  },
  "keywords": [
    "Platter"
  ],
  "type": "mcp",
  "mcpDetails": {
    "registryType": "mcpb",
    "identifier": "https://github.com/hadriangateway/platter/releases/download/v2.0.3/platter-linux-x64.mcpb",
    "transport": "stdio"
  },
  "targets": [
    {
      "agentId": "dsh",
      "agentVersionRange": null,
      "versionScheme": "unknown",
      "compatibilityStatus": "unknown",
      "compatibilityNote": "The archived source did not provide a parseable Agent version range; this record is metadata-only and unverified.",
      "status": "active"
    }
  ],
  "distributions": [
    {
      "id": "upstream",
      "type": "registry",
      "url": "https://github.com/hadriangateway/platter/releases/download/v2.0.3/platter-linux-x64.mcpb",
      "priority": 10,
      "registry": "mcpb"
    }
  ],
  "lifecycle": {
    "status": "active"
  },
  "createdAt": "2026-09-22T09:00:00Z",
  "updatedAt": "2026-09-22T09:00:00Z",
  "publishedAt": "2026-09-22T09:00:00Z",
  "_meta": {
    "io.github.metaone01/registry": {
      "source": "registry.modelcontextprotocol.io",
      "serverName": "io.github.hadriangateway/platter",
      "publishedAt": "2026-06-09T13:20:32.14636Z",
      "updatedAt": "2026-06-09T13:20:32.14636Z",
      "identityEvidence": "mcpb-bundle-url"
    },
    "org.agentforge/migration": {
      "sourceSchemaVersion": 1,
      "collectedAt": "2026-09-22T09:00:00Z",
      "legacyPath": "sources\\mcp\\packages\\io.github.hadriangateway__platter.json"
    }
  }
}
