{
  "schemaVersion": 2,
  "id": "mcp.io.github.pipeworx-io/theaudiodb",
  "name": "io.github.pipeworx-io/theaudiodb",
  "displayName": "Theaudiodb",
  "version": "0.1.2",
  "versionScheme": "unknown",
  "type": "mcp",
  "description": "TheAudioDB MCP — community music metadata database.",
  "license": "unknown",
  "targets": [
    {
      "agentId": "dsh",
      "agentVersionRange": null,
      "versionScheme": "unknown",
      "compatibilityStatus": "unknown",
      "compatibilityNote": "Discovery association only; no parseable upstream Agent compatibility range was supplied."
    }
  ],
  "createdAt": "2026-10-02T05:18:39Z",
  "updatedAt": "2026-10-02T05:18:39Z",
  "mcpDetails": {
    "registryType": "other",
    "identifier": "io.github.pipeworx-io/theaudiodb",
    "remotes": [
      {
        "url": "https://gateway.pipeworx.io/theaudiodb/mcp",
        "transport": "streamable-http"
      }
    ]
  },
  "distributions": [
    {
      "id": "upstream-12b998baa7b9c66e",
      "type": "other",
      "url": "https://gateway.pipeworx.io/theaudiodb/mcp",
      "install": {
        "type": "api",
        "url": "https://gateway.pipeworx.io/theaudiodb/mcp"
      },
      "notes": "Declared MCP endpoint; not a downloadable package."
    }
  ],
  "links": {
    "repository": "https://github.com/pipeworx-io/mcp-theaudiodb",
    "homepage": "https://pipeworx.io/packs/theaudiodb"
  },
  "lifecycle": {
    "status": "active"
  },
  "_meta": {
    "org.agentforge/collection": {
      "sources": [
        {
          "repository": "mcp-registry",
          "path": "v0.1/servers?page=288",
          "revision": "2026-10-02T05:18:39Z",
          "entry": "io.github.pipeworx-io/theaudiodb"
        }
      ],
      "classification": "upstream-metadata",
      "observedAt": "2026-10-02T05:18:39Z"
    }
  }
}
