{
  "schemaVersion": 2,
  "id": "plugin.61e5fe3447765544bd90b2296e6f69dd9706d6fdab6b02d62725466b5b2c1689",
  "name": "KhalilYamber/dsh-tidewatch",
  "displayName": "KhalilYamber/dsh-tidewatch",
  "version": "unversioned",
  "versionScheme": "unknown",
  "type": "plugin",
  "description": "DeepSeek 峰谷时刻悬浮卡片：官方峰谷时段、当前档位、距下一阶段倒计时与本次会话 API 花费（人民币）。A floating tide card for DeepSeek Harness: official peak/off-peak windows, live phase countdown and this session's API cost in CNY.",
  "license": "unknown",
  "targets": [
    {
      "agentId": "dsh",
      "agentVersionRange": null,
      "versionScheme": "unknown",
      "compatibilityStatus": "unknown",
      "compatibilityNote": "Discovery association only; no parseable upstream Agent compatibility range was supplied."
    }
  ],
  "createdAt": "2026-10-02T05:18:39Z",
  "updatedAt": "2026-10-02T05:18:39Z",
  "pluginDetails": {
    "manifestPath": "package.json",
    "sourceType": "git"
  },
  "links": {
    "repository": "https://github.com/KhalilYamber/dsh-tidewatch",
    "readme": "https://github.com/KhalilYamber/dsh-tidewatch#readme"
  },
  "distributions": [
    {
      "id": "upstream-git",
      "type": "git",
      "url": "https://github.com/KhalilYamber/dsh-tidewatch"
    },
    {
      "id": "npm-f83af74c27af",
      "type": "registry",
      "url": "https://www.npmjs.com/package/dsh-tidewatch",
      "registry": "npm"
    }
  ],
  "keywords": [
    "memory",
    "usage"
  ],
  "_meta": {
    "org.agentforge/collection": {
      "sources": [
        {
          "repository": "dshworks/awesome-dsh-plugins",
          "revision": "6c211eaaab7e74e7cb3e5c04110ec1db88510074",
          "path": "data/plugins.json",
          "entry": "9449"
        },
        {
          "repository": "white0dew/awesome-dsh-plugins",
          "revision": "55ece09ae6278782389c3cc64691ec8797b26623",
          "path": "data/sources/github-topic-dsh-plugin.json",
          "entry": "1641"
        },
        {
          "repository": "bruc3van/awesome-dsh-plugin",
          "revision": "d562ead4b6b62cc8ebaf77f469335dfd6b659897",
          "path": "data/repositories.json",
          "entry": "8004"
        },
        {
          "repository": "npm-search:dsh-plugin",
          "revision": "2026-10-02T05:18:39Z",
          "path": "-/v1/search",
          "entry": "dsh-tidewatch"
        }
      ],
      "classification": "upstream-metadata",
      "observedAt": "2026-10-02T05:18:39Z"
    }
  }
}
