{
  "schemaVersion": 2,
  "id": "mcp.io.github.jasoncbraatz/fintable-mcp",
  "name": "io.github.jasoncbraatz/fintable-mcp",
  "version": "0.1.1",
  "versionScheme": "semver",
  "description": "Unofficial MCP server for fintable.io — manage financial categories, rules, and transactions.",
  "license": "MIT License",
  "links": {
    "repository": "https://github.com/jasoncbraatz/fintable-mcp",
    "homepage": "https://fintable.io",
    "readme": "https://github.com/jasoncbraatz/fintable-mcp#readme"
  },
  "keywords": [
    "Fintable MCP"
  ],
  "type": "mcp",
  "mcpDetails": {
    "registryType": "pypi",
    "identifier": "fintable-mcp",
    "registryBaseUrl": "https://pypi.org/",
    "transport": "stdio"
  },
  "targets": [
    {
      "agentId": "dsh",
      "agentVersionRange": null,
      "versionScheme": "unknown",
      "compatibilityStatus": "unknown",
      "compatibilityNote": "The archived source did not provide a parseable Agent version range; this record is metadata-only and unverified.",
      "status": "active"
    }
  ],
  "distributions": [
    {
      "id": "upstream",
      "type": "registry",
      "url": "https://pypi.org/project/fintable-mcp/",
      "priority": 10,
      "registry": "pypi"
    }
  ],
  "lifecycle": {
    "status": "active"
  },
  "createdAt": "2026-09-22T09:00:00Z",
  "updatedAt": "2026-09-22T09:00:00Z",
  "publishedAt": "2026-09-22T09:00:00Z",
  "_meta": {
    "io.github.metaone01/registry": {
      "source": "registry.modelcontextprotocol.io",
      "serverName": "io.github.jasoncbraatz/fintable-mcp",
      "publishedAt": "2026-04-07T22:06:13.609847Z",
      "updatedAt": "2026-04-07T22:06:13.609847Z",
      "identityEvidence": "pypi-json"
    },
    "org.agentforge/migration": {
      "sourceSchemaVersion": 1,
      "collectedAt": "2026-09-22T09:00:00Z",
      "legacyPath": "sources\\mcp\\packages\\io.github.jasoncbraatz__fintable-mcp.json"
    }
  }
}
