{
  "schemaVersion": 2,
  "id": "plugin.00ed85c8b425498fc3f316e7a704c691d286ecfa8cd0414d52f1b5727ccfbab6",
  "name": "yangl326-Dylan/learning-dsh/packages/plugin",
  "displayName": "yangl326-Dylan/learning-dsh/packages/plugin",
  "version": "unversioned",
  "versionScheme": "unknown",
  "type": "plugin",
  "description": "Learning dsh plugin — versioned bilingual source-code learning page for DeepSeek Harness",
  "license": "unknown",
  "targets": [
    {
      "agentId": "dsh",
      "agentVersionRange": null,
      "versionScheme": "unknown",
      "compatibilityStatus": "unknown",
      "compatibilityNote": "Discovery association only; no parseable upstream Agent compatibility range was supplied."
    }
  ],
  "createdAt": "2026-10-02T05:18:39Z",
  "updatedAt": "2026-10-02T05:18:39Z",
  "pluginDetails": {
    "manifestPath": "packages/plugin/package.json",
    "sourceType": "git"
  },
  "links": {
    "repository": "https://github.com/yangl326-Dylan/learning-dsh",
    "readme": "https://github.com/yangl326-Dylan/learning-dsh#readme"
  },
  "distributions": [
    {
      "id": "upstream-git",
      "type": "git",
      "url": "https://github.com/yangl326-Dylan/learning-dsh/tree/HEAD/packages/plugin"
    }
  ],
  "keywords": [
    "capabilities"
  ],
  "_meta": {
    "org.agentforge/collection": {
      "sources": [
        {
          "repository": "dshworks/awesome-dsh-plugins",
          "revision": "6c211eaaab7e74e7cb3e5c04110ec1db88510074",
          "path": "data/plugins.json",
          "entry": "11269"
        },
        {
          "repository": "white0dew/awesome-dsh-plugins",
          "revision": "55ece09ae6278782389c3cc64691ec8797b26623",
          "path": "data/sources/github-plugin-catalog.json",
          "entry": "2678"
        },
        {
          "repository": "white0dew/awesome-dsh-plugins",
          "revision": "55ece09ae6278782389c3cc64691ec8797b26623",
          "path": "data/sources/github-topic-dsh-plugin.json",
          "entry": "4361"
        },
        {
          "repository": "bruc3van/awesome-dsh-plugin",
          "revision": "d562ead4b6b62cc8ebaf77f469335dfd6b659897",
          "path": "data/repositories.json",
          "entry": "1764"
        }
      ],
      "classification": "upstream-metadata",
      "observedAt": "2026-10-02T05:18:39Z"
    }
  }
}
