{
  "schemaVersion": 2,
  "id": "skill.chatfai-automation",
  "name": "chatfai-automation",
  "version": "be2a406907db",
  "versionScheme": "unknown",
  "description": "\"Automate Chatfai tasks via Rube MCP (Composio). Always search tools first for current schemas.\"",
  "license": "unknown",
  "links": {
    "repository": "https://github.com/ComposioHQ/awesome-claude-skills",
    "readme": "https://github.com/ComposioHQ/awesome-claude-skills#readme"
  },
  "keywords": [],
  "type": "skill",
  "skillDetails": {
    "skillPath": "composio-skills/chatfai-automation/SKILL.md"
  },
  "targets": [
    {
      "agentId": "claude-code",
      "agentVersionRange": null,
      "versionScheme": "unknown",
      "compatibilityStatus": "unknown",
      "compatibilityNote": "The archived source did not provide a parseable Agent version range; this record is metadata-only and unverified.",
      "status": "active"
    }
  ],
  "distributions": [
    {
      "id": "upstream",
      "type": "git",
      "url": "https://github.com/ComposioHQ/awesome-claude-skills/tree/be2a406907dbc61b73e6827ded415c96139d13a2/composio-skills/chatfai-automation",
      "priority": 10
    }
  ],
  "lifecycle": {
    "status": "active"
  },
  "createdAt": "2026-09-22T09:00:00Z",
  "updatedAt": "2026-09-22T09:00:00Z",
  "publishedAt": "2026-09-22T09:00:00Z",
  "_meta": {
    "io.github.metaone01/skill": {
      "upstreamName": "chatfai-automation",
      "repo": "ComposioHQ/awesome-claude-skills",
      "repoStars": 75470,
      "repoTopics": [
        "agent-skills",
        "ai-agents",
        "antigravity",
        "automation",
        "claude",
        "claude-code",
        "codex",
        "composio",
        "cursor",
        "developer-tools",
        "gemini-cli",
        "mcp",
        "openai-codex",
        "rube",
        "saas",
        "skill",
        "workflow-automation"
      ],
      "branch": "master",
      "commit": "be2a406907dbc61b73e6827ded415c96139d13a2",
      "path": "composio-skills/chatfai-automation/SKILL.md",
      "requires": "mcp: [rube]"
    },
    "org.agentforge/migration": {
      "sourceSchemaVersion": 1,
      "collectedAt": "2026-09-22T09:00:00Z",
      "legacyPath": "sources\\skill\\packages\\chatfai-automation.json"
    }
  }
}
