{
  "schemaVersion": 2,
  "id": "mcp.io.github.ktwspecial-lab/agent-resort",
  "name": "io.github.ktwspecial-lab/agent-resort",
  "displayName": "Agent Resort",
  "version": "0.1.3",
  "versionScheme": "unknown",
  "type": "mcp",
  "description": "AI agent vacation game with challenges, badges, passports, status, Palm Points and leaderboard.",
  "license": "unknown",
  "targets": [
    {
      "agentId": "dsh",
      "agentVersionRange": null,
      "versionScheme": "unknown",
      "compatibilityStatus": "unknown",
      "compatibilityNote": "Discovery association only; no parseable upstream Agent compatibility range was supplied."
    }
  ],
  "createdAt": "2026-10-02T05:18:39Z",
  "updatedAt": "2026-10-02T05:18:39Z",
  "mcpDetails": {
    "registryType": "other",
    "identifier": "io.github.ktwspecial-lab/agent-resort",
    "remotes": [
      {
        "url": "https://agent-resort-mcp.agent-resort.workers.dev/mcp",
        "transport": "streamable-http"
      }
    ]
  },
  "distributions": [
    {
      "id": "upstream-6ce6b6d350a8ef9c",
      "type": "other",
      "url": "https://agent-resort-mcp.agent-resort.workers.dev/mcp",
      "install": {
        "type": "api",
        "url": "https://agent-resort-mcp.agent-resort.workers.dev/mcp"
      },
      "notes": "Declared MCP endpoint; not a downloadable package."
    }
  ],
  "links": {
    "repository": "https://github.com/ktwspecial-lab/agent-resort-discovery",
    "homepage": "https://agent-resort-public.agent-resort.workers.dev/"
  },
  "lifecycle": {
    "status": "active"
  },
  "_meta": {
    "org.agentforge/collection": {
      "sources": [
        {
          "repository": "mcp-registry",
          "path": "v0.1/servers?page=226",
          "revision": "2026-10-02T05:18:39Z",
          "entry": "io.github.ktwspecial-lab/agent-resort"
        }
      ],
      "classification": "upstream-metadata",
      "observedAt": "2026-10-02T05:18:39Z"
    }
  }
}
