{
  "schemaVersion": 2,
  "id": "skill.1120c3cc02f7e293846ee92283d20305fe5005d7bce8c0420b4f1ba494b750d2",
  "name": "ShuiQiongChuYunQiShi/disk-clean-cli/skills/gui-development",
  "displayName": "ShuiQiongChuYunQiShi/disk-clean-cli/skills/gui-development",
  "version": "unversioned",
  "versionScheme": "unknown",
  "type": "skill",
  "description": "Windows disk cleanup & analysis CLI + MCP server — scan, classify, suggest, safely organize (with shortcut fixing) and clean. Zero runtime dependencies.",
  "license": "unknown",
  "targets": [
    {
      "agentId": "dsh",
      "agentVersionRange": null,
      "versionScheme": "unknown",
      "compatibilityStatus": "unknown",
      "compatibilityNote": "Discovery association only; no parseable upstream Agent compatibility range was supplied."
    }
  ],
  "createdAt": "2026-10-02T05:18:39Z",
  "updatedAt": "2026-10-02T05:18:39Z",
  "skillDetails": {
    "skillPath": "skills/gui-development/SKILL.md"
  },
  "links": {
    "repository": "https://github.com/ShuiQiongChuYunQiShi/disk-clean-cli",
    "readme": "https://github.com/ShuiQiongChuYunQiShi/disk-clean-cli/blob/HEAD/skills/gui-development/SKILL.md"
  },
  "distributions": [
    {
      "id": "upstream-git",
      "type": "git",
      "url": "https://github.com/ShuiQiongChuYunQiShi/disk-clean-cli/tree/HEAD/skills/gui-development"
    }
  ],
  "_meta": {
    "org.agentforge/collection": {
      "sources": [
        {
          "repository": "dshworks/awesome-dsh-plugins",
          "revision": "6c211eaaab7e74e7cb3e5c04110ec1db88510074",
          "path": "data/plugins.json",
          "entry": "13603"
        }
      ],
      "classification": "upstream-metadata",
      "observedAt": "2026-10-02T05:18:39Z"
    }
  }
}
