{
  "schemaVersion": 2,
  "id": "mcp.io.github.jpka/shopify-operations-mcp",
  "name": "io.github.jpka/shopify-operations-mcp",
  "displayName": "shopify-operations-mcp",
  "version": "0.1.2",
  "versionScheme": "unknown",
  "type": "mcp",
  "description": "Safe-write Shopify operations: plan-before-execute writes with out-of-band approval and audit.",
  "license": "unknown",
  "targets": [
    {
      "agentId": "dsh",
      "agentVersionRange": null,
      "versionScheme": "unknown",
      "compatibilityStatus": "unknown",
      "compatibilityNote": "Discovery association only; no parseable upstream Agent compatibility range was supplied."
    }
  ],
  "createdAt": "2026-09-22T09:00:00Z",
  "updatedAt": "2026-10-02T05:18:39Z",
  "mcpDetails": {
    "registryType": "npm",
    "identifier": "shopify-operations-mcp",
    "transport": "stdio"
  },
  "distributions": [
    {
      "id": "upstream-2284d2a8d92abaef",
      "type": "registry",
      "url": "https://www.npmjs.com/package/shopify-operations-mcp",
      "registry": "npm",
      "version": "0.1.2"
    }
  ],
  "links": {
    "repository": "https://github.com/jpka/shopify-operations-mcp"
  },
  "lifecycle": {
    "status": "active"
  },
  "_meta": {
    "io.github.metaone01/registry": {
      "source": "registry.modelcontextprotocol.io",
      "serverName": "io.github.jpka/shopify-operations-mcp",
      "publishedAt": "2026-08-17T01:24:41.99129Z",
      "updatedAt": "2026-08-17T01:24:41.99129Z",
      "identityEvidence": "npm-packument"
    },
    "org.agentforge/migration": {
      "sourceSchemaVersion": 1,
      "collectedAt": "2026-09-22T09:00:00Z",
      "legacyPath": "sources\\mcp\\packages\\io.github.jpka__shopify-operations-mcp.json"
    },
    "org.agentforge/collection": {
      "sources": [
        {
          "repository": "mcp-registry",
          "path": "v0.1/servers?page=221",
          "revision": "2026-10-02T05:18:39Z",
          "entry": "io.github.jpka/shopify-operations-mcp"
        }
      ],
      "classification": "upstream-metadata",
      "observedAt": "2026-10-02T05:18:39Z"
    }
  }
}
